<root xmlns:xsi="http://www.w3.org/2001/XMLSchema-instance" xsi:schemaLocation="https://www.w3schools.com index-schema.xsd">
  <!-- My example data is clearly very technical-->
  <peer>
    <address>4O5y6PUBZD6Kziz2eWo3n1TNHVTfT7x6eKwLPPUdVls=</address>
    <sign salt="1234567890123456">ptNtqdUn/MtpoHFLgcodcYaD9DAmV3xVRI9+/K7pZGYIccNd61KC4LrIZz+bEhznR+f3p/hXWK7jWD/jzPdXCw==</sign>
    <desc name="my peer">my cool peer</desc>
    <ipv4>192.168.1.100</ipv4>
    <services>
      <service version="+/R0wiWAKlUmwqA2XjdYfspZ8Gu7StXKSc1u+C2naAs=">
        <uaddress name="woot">O/iFe/g2ENRQfye0u0dmPd+cMUq7LoRfqmXnJt74X84=</uaddress>
      </service>
    </services>
  </peer>
  <master>
    <address>WzJmdiSCSxk5dnT6P65UhDyNdjBnBy5E3fDxigWOHCs=</address>
    <sign salt="1234567890123456">ptNtqdUn/MtpoHFLgcodcYaD9DAmV3xVRI9+/K7pZGYIccNd61KC4LrIZz+bEhznR+f3p/hXWK7jWD/jzPdXCw==</sign>
    <desc name="my master node">my EVEN cool master node</desc>
    <services>
      <service version="+/R0wiWAKlUmwqA2XjdYfspZ8Gu7StXKSc1u+C2naAs=">
        <desc name="woot">ya man</desc>
        <data>
          <files>
            <file rdir="assets/pic.img" type="static">+/R0wiWAKlUmwqA2XjdYfspZ8Gu7StXKSc1u+C2naAs=</file>
          </files>
        </data>
      </service>
    </services>
  </master>
</root>
